{
  "$schema": "https://json-schema.org/draft/2020-12/schema",
  "title": "PolicyCard deck book (G7 content-decks; \u00a77.14 / Appendix B)",
  "description": "Shape of packages/content/decks/*.json \u2014 a JSON book of PolicyCards a host reads to feed the boot.rules rider. The wire sibling is apps/proto/src/shared/protocol.ts BootRulesWire ({hash, card} entries); hashes stay host-owned lookup keys (protocol.ts:355-362) and NEVER live in this file. Fields the strict loader would fence (era, availableFrom) are deliberately absent \u2014 the schema must not invite them. Only the subset this repo's script/validate.mjs interpreter understands is used declaratively here (type, enum, pattern, required, items, minItems/maxItems). Two honest interpreter limits: boolean additionalProperties:false is DECLARED as law but not machine-enforced by the interpreter, and enum is only checked on strings \u2014 so the exact-key fences and the schemaVersion=1 wall are hand-enforced on the validator deck leg. The deeper grammar-meaning walls \u2014 comparator\u00d7threshold arm pairing, runbookName discipline, estate ref null, positive FOR duration, non-negative upkeep, else band-ref pairing, duplicate card ids, appliesTo resolution, \u00a79.11 technique bans, door-carrier coverage \u2014 are hand-enforced clause-for-clause against packages/sim-core/src/policy/grammar.ts validatePolicyCard.",
  "type": "object",
  "required": ["schemaVersion", "deckId", "appliesTo", "cards"],
  "additionalProperties": false,
  "properties": {
    "schemaVersion": { "type": "integer", "enum": [1], "description": "Deck-file version space, its own (i18n-pack precedent). The interpreter cannot police integer enums; the validator leg fails loud on anything but 1." },
    "deckId": { "type": "string", "pattern": "^deck:[a-z][a-z0-9.-]*$", "description": "Book identity, packId grammar mirrored (i18n-pack.schema.json:9)." },
    "name": { "type": "string", "description": "Human title for the shelf; no engine meaning." },
    "appliesTo": { "type": "string", "pattern": "^[a-z0-9][a-z0-9-]*:[a-z0-9][a-z0-9-]*$", "description": "Bundle-id grammar (validate.mjs ID_RE namespace form). Resolves at runtime to a shipped types/*.json id OR a reserved core:* id \u2014 the hand-enforced resolution wall; v0 has no bundle claimant for decks, so no reverse orphan law is invented." },
    "cards": {
      "type": "array",
      "description": "The book. An empty array is legal (boot.rules {entries:[]} posture); card ids must be unique within one deck (door card-id-collision law, intent-door.ts handlePolicyCardCommit) \u2014 duplicates across co-shipped decks are a hand-enforced WARN.",
      "items": {
        "type": "object",
        "required": ["id", "scope", "when", "then", "band", "upkeepMicroUsd"],
        "additionalProperties": false,
        "properties": {
          "id": { "type": "string", "pattern": "^([a-z0-9][a-z0-9-]*:)?[a-z0-9][a-z0-9-]*$", "description": "RuleId \u2014 house id grammar (validate.mjs:77)." },
          "scope": {
            "type": "object",
            "required": ["kind", "ref"],
            "additionalProperties": false,
            "properties": {
              "kind": { "type": "string", "enum": ["object", "role", "query", "class", "estate"] },
              "ref": { "type": ["string", "null"], "description": "Non-empty for every kind except estate; estate MUST be null (grammar.ts:231-233, hand-enforced both ways)." }
            }
          },
          "when": {
            "type": "array",
            "minItems": 1,
            "maxItems": 3,
            "description": "Grammar tuple 1..3 \u2014 one rule = one story (types.ts:697). Interpreter minItems/maxItems support verified by probe.",
            "items": { "$comment": "predicate \u2014 duplicated for unless because the interpreter has no $ref.", "type": "object", "required": ["metric", "comparator", "threshold"], "additionalProperties": false, "properties": { "metric": { "type": "string" }, "comparator": { "type": "string", "enum": [">", "<", "changed", "fails", "completes"] }, "threshold": { "type": "object", "required": ["kind"], "additionalProperties": false, "properties": { "kind": { "type": "string", "enum": ["value", "class-ref", "event-name"] }, "amount": { "type": "string", "pattern": "^-?\\d+$", "description": "Fixed bigint as decimal string (WireFixed law)." }, "unit": { "type": "string", "enum": ["percent", "us", "ms", "count", "micro-usd", "ratio", "minutes"] }, "classId": { "type": "string" }, "name": { "type": "string" } } } } }
          },
          "for": {
            "type": "object",
            "required": ["durationUs"],
            "additionalProperties": false,
            "properties": { "durationUs": { "type": "string", "pattern": "^-?\\d+$", "description": "Sustained-window debounce, \u00b5s decimal string; strictly positive is a hand-enforced wall (grammar.ts:246)." } }
          },
          "then": {
            "type": "array",
            "minItems": 1,
            "maxItems": 3,
            "items": { "type": "object", "required": ["id", "runbookName", "value"], "additionalProperties": false, "properties": { "id": { "type": "string", "enum": ["scale-out", "shed-class", "page", "open-ticket", "dispatch-remote-hands", "raise-inspection-depth", "failover", "run-runbook", "drain", "queue-change"] }, "runbookName": { "type": ["string", "null"], "description": "Non-empty ONLY on run-runbook; null everywhere else (grammar.ts:201-205, hand-enforced)." }, "value": { "type": ["string", "null"], "pattern": "^-?\\d+$", "description": "Fixed as decimal string where the verb takes one; null otherwise." } } }
          },
          "unless": {
            "type": "array",
            "minItems": 1,
            "maxItems": 3,
            "items": { "type": "object", "required": ["metric", "comparator", "threshold"], "additionalProperties": false, "properties": { "metric": { "type": "string" }, "comparator": { "type": "string", "enum": [">", "<", "changed", "fails", "completes"] }, "threshold": { "type": "object", "required": ["kind"], "additionalProperties": false, "properties": { "kind": { "type": "string", "enum": ["value", "class-ref", "event-name"] }, "amount": { "type": "string", "pattern": "^-?\\d+$" }, "unit": { "type": "string", "enum": ["percent", "us", "ms", "count", "micro-usd", "ratio", "minutes"] }, "classId": { "type": "string" }, "name": { "type": "string" } } } } }
          },
          "else": {
            "type": "object",
            "required": ["to", "ref"],
            "additionalProperties": false,
            "properties": {
              "to": { "type": "string", "enum": ["band", "role", "runbook"] },
              "ref": { "type": "string", "description": "Non-empty always; when to=band it must be inform|consult|execute (grammar.ts:260-262, hand-enforced)." }
            }
          },
          "band": { "type": "string", "enum": ["inform", "consult", "execute"] },
          "upkeepMicroUsd": { "type": "string", "pattern": "^-?\\d+$", "description": "MoneyUnit as decimal string; non-negativity (grammar.ts:268) is the hand-enforced ^\\d+$ wall." }
        }
      }
    },
    "_provenance": {
      "type": "object",
      "description": "Optional card-id -> doc-cite map (nulls require _provenance._todo, house never-invent law).",
      "additionalProperties": { "type": ["string", "null"] }
    },
    "_todo": { "type": "string" }
  }
}
