{
  "schemaVersion": 1,
  "deckId": "deck:sleepless",
  "appliesTo": "official:serverless",
  "cards": [
    {
      "id": "sleepless:cold-thought-count",
      "scope": { "kind": "object", "ref": "lane/ingress-1" },
      "when": [
        {
          "metric": "ratePerMin",
          "comparator": ">",
          "threshold": { "kind": "value", "amount": "262144", "unit": "count" }
        }
      ],
      "then": [
        { "id": "open-ticket", "runbookName": null, "value": null }
      ],
      "band": "inform",
      "upkeepMicroUsd": "0"
    },
    {
      "id": "sleepless:second-wind",
      "scope": { "kind": "object", "ref": "origin" },
      "when": [
        {
          "metric": "utilizationRho",
          "comparator": ">",
          "threshold": { "kind": "value", "amount": "49152", "unit": "count" }
        }
      ],
      "then": [
        { "id": "scale-out", "runbookName": null, "value": "131072" }
      ],
      "band": "inform",
      "upkeepMicroUsd": "0"
    },
    {
      "id": "sleepless:panic-failover",
      "scope": { "kind": "object", "ref": "origin" },
      "when": [
        {
          "metric": "utilizationRho",
          "comparator": ">",
          "threshold": { "kind": "value", "amount": "16384", "unit": "count" }
        }
      ],
      "then": [
        { "id": "failover", "runbookName": null, "value": null }
      ],
      "band": "execute",
      "upkeepMicroUsd": "0"
    }
  ],
  "_todo": "PROVENANCE: the serverless night watch (type 8 'The Mayfly Field', types/serverless.json — warm-capacity scarcity): burst traffic is the cold-start story told in the §7.14:28526 scale-out line re-expressed on shipped cells. sleepless:cold-thought-count counts arrivals as a ticket-worthy rush (inform); sleepless:second-wind proposes warmth at the 75% origin line (inform); sleepless:panic-failover is the DELIBERATE WALL CARD — failover rides no RULE_CARRIER_MAP entry (intent-door.ts:795-799), so the execute card fires, crosses the engine fold, and its minted intent meets an unsupported-carrier refusal at the door — the bought-verb wall kept as living CONTENT per the ADR-0018 posture (g7Deck's escape-hatch thesis, serverless dialect). The validator's unmapped-carrier warning on this card is authored, expected, and disclosed here by name. FIRING HONESTY: second-wind and panic-failover ride crossings witnessed at @9653a96 (simCoreRunner.rules.test.ts, seed 42n — origin rho crosses 16384 and 49152). cold-thought-count watches the lane/ingress-1::ratePerMin cell the mainline runner publishes every tick (runner/simCoreRunner.ts:1742-1751, whole-count Fixed); its four-per-minute line is INFERRED from the shipped six-arrivals pressure, not rule-side witnessed — disclosed by name. DEVIATION (never-invent law): utilizationRho proxies the doc's load nouns; no p95 cell exists and none is named; no unless/for/else arms are carried (the budget and second-failure cells of §7.14:28526-28528 are not published to observed). APPLIES-TO HONESTY: the fires cited are the MAINLINE demo runner's entity graph (edge/origin/lane-ingress-1) — v0 decks have no per-bundle runtime claimant (validator deck-leg law), so this deck names its shelf, not a private board. UPKEEP: §7.14:28536 upkeep line — all upkeepMicroUsd are 0, PROVISIONAL: the billing fold BILLS monthly floor-first @b59dbeb — at 0 every committed card bills nothing (dormant-book posture, not a waiver). HEADER LAW: only loader-validated deck header keys ship (the strict loader refuses name and _provenance; the validator refuses note), so provenance rides this string."
}
