{
  "schemaVersion": 1,
  "deckId": "deck:cold-aisle",
  "appliesTo": "official:shared-web",
  "cards": [
    {
      "id": "cold-aisle:murmur-the-bell",
      "scope": { "kind": "object", "ref": "edge" },
      "when": [
        {
          "metric": "utilizationRho",
          "comparator": ">",
          "threshold": { "kind": "value", "amount": "16384", "unit": "count" }
        }
      ],
      "then": [
        { "id": "page", "runbookName": null, "value": null }
      ],
      "band": "inform",
      "upkeepMicroUsd": "0"
    },
    {
      "id": "cold-aisle:ask-the-senior-again",
      "scope": { "kind": "object", "ref": "edge" },
      "when": [
        {
          "metric": "utilizationRho",
          "comparator": ">",
          "threshold": { "kind": "value", "amount": "16384", "unit": "count" }
        }
      ],
      "then": [
        { "id": "open-ticket", "runbookName": null, "value": null }
      ],
      "band": "consult",
      "upkeepMicroUsd": "0"
    },
    {
      "id": "cold-aisle:quarter-watch",
      "scope": { "kind": "object", "ref": "origin" },
      "when": [
        {
          "metric": "utilizationRho",
          "comparator": ">",
          "threshold": { "kind": "value", "amount": "49152", "unit": "count" }
        }
      ],
      "then": [
        { "id": "scale-out", "runbookName": null, "value": "131072" }
      ],
      "band": "inform",
      "upkeepMicroUsd": "0"
    },
    {
      "id": "cold-aisle:queue-etiquette",
      "scope": { "kind": "object", "ref": "lane/ingress-1" },
      "when": [
        {
          "metric": "ratePerMin",
          "comparator": ">",
          "threshold": { "kind": "value", "amount": "196608", "unit": "count" }
        }
      ],
      "then": [
        { "id": "shed-class", "runbookName": null, "value": null }
      ],
      "band": "inform",
      "upkeepMicroUsd": "0"
    },
    {
      "id": "cold-aisle:health-ribbon",
      "scope": { "kind": "object", "ref": "lane/ingress-1" },
      "when": [
        {
          "metric": "health",
          "comparator": "<",
          "threshold": { "kind": "value", "amount": "49152", "unit": "count" }
        }
      ],
      "then": [
        { "id": "open-ticket", "runbookName": null, "value": null }
      ],
      "band": "consult",
      "upkeepMicroUsd": "0"
    }
  ],
  "_todo": "PROVENANCE: the shared-web night posture — hosting_game.md §7.14:28541-28543 'a rule that is 95% right is better than a human who is 100% right and asleep', composed on §7.14:28594-28599 delegation bands: inform is 'they do it and tell you', consult is 'they propose and you approve'. Five of five cards are advisory — zero EXECUTE rows: at 3am this book writes tape and pending proposals, it mints no intents (the bands' own semantics, evaluator.ts inform/consult arms). murmur-the-bell pages as INFORM (the bell rings, nobody is phoned); ask-the-senior-again and health-ribbon open tickets as CONSULT; quarter-watch re-expresses the §7.14:28526 scale-out line at the 75% rho line the watch-the-door underwriter watches. FIRING HONESTY: the three edge/origin cards ride the exact crossings witnessed at @9653a96 (simCoreRunner.rules.test.ts, seed 42n) — they fire on the mainline. cold-aisle:queue-etiquette and cold-aisle:health-ribbon watch lane/ingress-1 cells the mainline runner publishes every tick (runner/simCoreRunner.ts:1742-1764: ratePerMin as whole-count Fixed, health as 1 minus worst-node rho) but their crossings are INFERRED from the shipped six-arrivals-per-minute pressure, not rule-side witnessed — disclosed per-card by name here. DEVIATION (never-invent law): utilizationRho stands proxy for the doc's load/cpu nouns; no p95 latency cell exists and none is named; no unless/for/else arm is carried — the budget-remaining and second-failure cells of §7.14:28526-28528 are not published to observed, and the sustained-window arm has no shipped witness. UPKEEP: §7.14:28536 'each carries a small upkeep' — all upkeepMicroUsd are 0, PROVISIONAL: the billing fold BILLS monthly floor-first @b59dbeb — at 0 every committed card bills nothing (dormant-book posture, not a waiver). HEADER LAW: only loader-validated deck header keys ship (the strict loader refuses name and _provenance; the validator refuses note), so provenance rides this string."
}
