{
  "schemaVersion": 1,
  "deckId": "deck:watch-the-door",
  "appliesTo": "core:g7",
  "cards": [
    {
      "id": "watch-the-door:watch-the-door",
      "scope": { "kind": "object", "ref": "edge" },
      "when": [
        {
          "metric": "utilizationRho",
          "comparator": ">",
          "threshold": { "kind": "value", "amount": "16384", "unit": "count" }
        }
      ],
      "then": [
        { "id": "raise-inspection-depth", "runbookName": null, "value": "131072" }
      ],
      "band": "execute",
      "upkeepMicroUsd": "25000"
    },
    {
      "id": "watch-the-door:page-the-founder",
      "scope": { "kind": "object", "ref": "edge" },
      "when": [
        {
          "metric": "utilizationRho",
          "comparator": ">",
          "threshold": { "kind": "value", "amount": "16384", "unit": "count" }
        }
      ],
      "then": [
        { "id": "page", "runbookName": null, "value": null }
      ],
      "band": "execute",
      "upkeepMicroUsd": "25000"
    },
    {
      "id": "watch-the-door:shed-the-small",
      "scope": { "kind": "object", "ref": "edge" },
      "when": [
        {
          "metric": "utilizationRho",
          "comparator": ">",
          "threshold": { "kind": "value", "amount": "16384", "unit": "count" }
        }
      ],
      "then": [
        { "id": "shed-class", "runbookName": null, "value": null }
      ],
      "band": "execute",
      "upkeepMicroUsd": "25000"
    },
    {
      "id": "watch-the-door:escape-hatch",
      "scope": { "kind": "object", "ref": "origin" },
      "when": [
        {
          "metric": "utilizationRho",
          "comparator": ">",
          "threshold": { "kind": "value", "amount": "16384", "unit": "count" }
        }
      ],
      "then": [
        { "id": "failover", "runbookName": null, "value": null }
      ],
      "band": "execute",
      "upkeepMicroUsd": "40000"
    },
    {
      "id": "watch-the-door:the-underwriter",
      "scope": { "kind": "object", "ref": "origin" },
      "when": [
        {
          "metric": "utilizationRho",
          "comparator": ">",
          "threshold": { "kind": "value", "amount": "49152", "unit": "count" }
        }
      ],
      "then": [
        { "id": "scale-out", "runbookName": null, "value": "131072" }
      ],
      "band": "inform",
      "upkeepMicroUsd": "5000"
    },
    {
      "id": "watch-the-door:ask-the-senior",
      "scope": { "kind": "object", "ref": "edge" },
      "when": [
        {
          "metric": "utilizationRho",
          "comparator": ">",
          "threshold": { "kind": "value", "amount": "16384", "unit": "count" }
        }
      ],
      "then": [
        { "id": "open-ticket", "runbookName": null, "value": null }
      ],
      "band": "consult",
      "upkeepMicroUsd": "10000"
    }
  ],
  "_todo": "PROVENANCE: this is the six-card gates/g7 book (apps/proto/src/gates/g7/g7Deck.ts:41-51,75-82) re-authored as shipped JSON, riding the four composed-grammar examples of hosting_game.md §7.14:28526-28530 — 'web-tier CPU > 85%' scale-out (:28518) rides the-underwriter, 'a drive fails then open a ticket' and 'page me' (:28519-28520) ride ask-the-senior and page-the-founder, 'load > 90% then shed class 4' (:28521) rides shed-the-small, 'raise inspection depth to Sample on the edge tier' (:28522) rides watch-the-door. DEVIATION (never-invent law): the doc speaks CPU, p95 and load cells the mainline never publishes; utilizationRho is the published Q16.16 Fixed load-pressure cell (pipeline/defaults.ts:1755-1756) and stands proxy for all of them — a p95 latency metric does not exist in the engine and was NOT named here. DEVIATION: the g7 board's BUSY threshold 40960 retargets to 16384 — the mainline runner's edge rho alternates 0/32768 (6 arrivals/min into a one-slot edge), so 40960 would be an honest NEVER-fire (the @9653a96 zero-fire witness); 16384 is the crossing witnessed at frame 6 in apps/proto/src/__tests__/simCoreRunner.rules.test.ts (seed 42n). DEVIATION: scope refs retarget node/edge and node/origin (g7's private micro-board ids) to edge and origin — the mainline runner's entity ids; card ids gain the deck slug as a namespace (the house id grammar forbids the brief-era dotted form). DEVIATION: escape-hatch is the bought-verb wall kept as CONTENT — failover rides no RULE_CARRIER_MAP entry (intent-door.ts:795-799), so the fired rule reaches an unsupported-carrier refusal at the door; this mirrors g7Deck's thesis verbatim (ticker-yes, board-no, ADR-0018) and the validator's unmapped-carrier warning is expected, not an oversight. DEVIATION: §7.14:28526's 'unless budget remaining < $200' arm is omitted, not faked — no budget cell is published to observed on the mainline (company::mrrMicroUsd has no engine publisher, discovered during the G7 recon); likewise the :28519-28520 'unless second failure in this array' counter arm and dispatch-remote-hands carrier are not carried (no published second-failure cell the grammar would honor), and the :28522 'for 60s' sustained window rides bare predicates because no shipped witness armed the for-arm. UPKEEP: §7.14:28536 'each carries a small upkeep' — THE RETUNE LANDED: every card now carries a small upkeep by delegation weight, no longer 0. The ladder: inform 5,000 / consult 10,000 / execute 25,000 µ$ per sim-minute, and an execute card whose action is the bought-verb wall (failover meets unsupported-verb-carrier at the door) is the dearest delegation a book can hold, priced ABOVE the plain execute at 40,000 — escape-hatch (failover) rides the wall line 40,000. Grounded on §7.14's delegation semantics (:28594-28599 — the deeper a card acts FOR you, the more it costs to keep) and the doc's own upkeep nouns: §1.6 :845 names 'the first upkeep bill' as an early beat, and :16453 prices upkeep as 'a recurring staff-hand cost' — upkeep is staff-shaped, and staff is what executing rules replace. All numerics PROVISIONAL — ratify-on-playtest (ADR-0016 #10 grammar); against the $4k/mo payroll and the $25k opening bankroll these read 'small' exactly as §7.14:28536 demands. At the billing fold @b59dbeb (one floor-first opex draft per business-month roll, t420 at the standard clock, Σ upkeeps x 420 sim-minutes of retroactive accrual v0) the book's Σ 130,000 µ$/min folds into 54,600,000 µ$ (~$54.60/mo); the live first-bill witness rides packages/sim-core/src/scenario/__tests__/deckUpkeepLive.test.ts. THE PROMISED MOTION DISCHARGED (wave-29 rider :28539): retuning upkeep re-derives every deckCardHash key of this deck at this commit — named, not hidden. HEADER LAW: the deck carries only the loader-intersection header keys — the strict loader refuses name and _provenance (loader/decks.ts DECK_TOP_LEVEL_KEYS) while the validator refuses note, so provenance rides this string, not a field."
}
